{
    "$schema": "http://json-schema.org/draft-07/schema#",
    "$id": "geoleaf/style",
    "title": "GeoLeaf Layer Style",
    "description": "Style definition for a GeoLeaf layer (flat format). Used in layers/*/styles/*.json. Strict schema (PRF-SCHEMA, Profile Contract v1). `id` is no longer required (filename acts as id for ~20% of style files). The MapLibre pass-through key is `paint` (kept open); `style.extends` enables style inheritance. Tolerated: `condition` as an alias of `when`, and root-level `paint`/`type` (misplaced). (`labelScale` is NOT a duplicate of `scaleConfig`: same unit, but it gates the labels, not the layer.)",
    "type": "object",
    "additionalProperties": false,
    "patternProperties": { "^_comment": {} },
    "properties": {
        "$schema": { "type": "string" },
        "id": {
            "type": "string",
            "description": "Unique identifier for this style (optional — defaults to the file name)."
        },
        "label": {
            "oneOf": [
                {
                    "type": "string",
                    "description": "Display label shown in the style selector."
                },
                {
                    "type": "object",
                    "description": "Label/text configuration for map features of this layer.",
                    "required": ["enabled"],
                    "additionalProperties": false,
                    "patternProperties": { "^_comment": {} },
                    "properties": {
                        "enabled": {
                            "type": "boolean",
                            "description": "Enable/disable these labels."
                        },
                        "visibleByDefault": {
                            "type": "boolean",
                            "default": false,
                            "description": "Labels visible on layer load without user action."
                        },
                        "field": {
                            "type": "string",
                            "description": "GeoJSON properties field name to display as label text."
                        },
                        "font": {
                            "type": "object",
                            "additionalProperties": false,
                            "patternProperties": { "^_comment": {} },
                            "properties": {
                                "sizePt": {
                                    "type": "number",
                                    "minimum": 1,
                                    "maximum": 72,
                                    "default": 9,
                                    "description": "Label text size in points, mapped to MapLibre `text-size`. Absent: 12 px, which is 9 pt. It is the only font key: the font stack comes from the loaded map style."
                                }
                            }
                        },
                        "color": {
                            "type": "string",
                            "pattern": "^#[0-9a-fA-F]{6}$",
                            "default": "#000000"
                        },
                        "opacity": {
                            "type": "number",
                            "minimum": 0,
                            "maximum": 1,
                            "default": 1
                        },
                        "buffer": {
                            "type": "object",
                            "additionalProperties": false,
                            "patternProperties": { "^_comment": {} },
                            "properties": {
                                "enabled": { "type": "boolean", "default": false },
                                "color": {
                                    "type": "string",
                                    "pattern": "^#[0-9a-fA-F]{6}$",
                                    "default": "#ffffff"
                                },
                                "sizePx": { "type": "number", "minimum": 0, "default": 2 }
                            }
                        },
                        "offset": {
                            "type": "object",
                            "description": "Label placement relative to the feature — LIVE (mapped to MapLibre text-anchor + text-radial-offset by _buildLabelOffsetLayout). Absent, or placement 'center', renders exactly as before: no anchor property is emitted at all.",
                            "additionalProperties": false,
                            "patternProperties": { "^_comment": {} },
                            "properties": {
                                "placement": {
                                    "type": "string",
                                    "enum": [
                                        "center",
                                        "top",
                                        "bottom",
                                        "left",
                                        "right",
                                        "top-left",
                                        "top-right",
                                        "bottom-left",
                                        "bottom-right"
                                    ],
                                    "default": "center",
                                    "description": "Side the LABEL sits on, NOT the MapLibre anchor (whose vocabulary is the opposite: a label above its feature anchors by its 'bottom'). The renderer holds the conversion table."
                                },
                                "distancePx": {
                                    "type": "number",
                                    "minimum": 0,
                                    "default": 12,
                                    "description": "Gap in CSS pixels between the feature and the nearest edge of the text box; converted to ems of text-size. Ignored when placement is 'center'. Rule of thumb: at least the marker radius plus 3 px, or half the drawn icon height. Below roughly 0.3 x text-size the engine's baseline correction cancels it out."
                                }
                            }
                        }
                    }
                }
            ]
        },
        "description": {
            "type": "string",
            "description": "Optional description for this style."
        },
        "scaleConfig": {
            "type": "object",
            "description": "Layer visibility by scale range. Bounds are SCALE DENOMINATORS (the X in 1:X), NOT MapLibre zoom levels — a denominator grows as you zoom OUT, so minScale is the widest view allowed and must be the LARGER number. Optional: omit for no constraint. Consumed by updateLayerVisibilityByZoom via isScaleInRange (scale-utils.ts). Replaces the retired `zoomConfig`, whose minZoom/maxZoom naming led authors to write zoom levels that the engine read as denominators — hiding those layers at every zoom (measured before the rename).",
            "additionalProperties": false,
            "patternProperties": { "^_comment": {} },
            "properties": {
                "minScale": {
                    "type": ["number", "null"],
                    "description": "Widest view allowed, as a scale denominator (e.g. 9222148 for 1:9 222 148 ≈ zoom 6 at lat 4°). Hidden when zoomed out past it. null or 0 = no lower bound."
                },
                "maxScale": {
                    "type": ["number", "null"],
                    "description": "Closest view allowed, as a scale denominator (e.g. 2252 for 1:2 252 ≈ zoom 18 at lat 4°). Hidden when zoomed in past it. null or 0 = no upper bound."
                }
            }
        },
        "labelScale": {
            "type": "object",
            "description": "Label visibility by scale range — LIVE feature (isScaleInRange in scale-utils.ts, consumed by labels.ts). minScale/maxScale are scale denominators, same unit as scaleConfig, but scoped to the layer's labels rather than the layer itself — NOT a duplicate.",
            "additionalProperties": false,
            "patternProperties": { "^_comment": {} },
            "properties": {
                "minScale": { "type": ["number", "null"] },
                "maxScale": { "type": ["number", "null"] }
            }
        },
        "style": {
            "$ref": "#/definitions/flatStyle"
        },
        "styleRules": {
            "type": "array",
            "description": "Data-driven style rules applied in order. First matching rule wins.",
            "items": {
                "$ref": "#/definitions/styleRule"
            }
        },
        "legend": {
            "type": "object",
            "description": "Legend entry for this style.",
            "additionalProperties": false,
            "patternProperties": { "^_comment": {} },
            "properties": {
                "label": { "type": "string" }
            }
        }
    },
    "definitions": {
        "flatStyle": {
            "type": "object",
            "description": "Flat GeoLeaf style (v2 format). Closed (additionalProperties:false) — the `paint` and `expressionPaint` blocks stay open for native MapLibre properties.",
            "additionalProperties": false,
            "patternProperties": { "^_comment": {} },
            "properties": {
                "extends": {
                    "type": "string",
                    "description": "Style id this rule-style inherits from (style inheritance)."
                },
                "fillColor": {
                    "type": "string",
                    "description": "Fill color (hex/CSS). Polygon layers."
                },
                "fillOpacity": {
                    "type": "number",
                    "minimum": 0,
                    "maximum": 1,
                    "description": "Fill opacity (0–1)."
                },
                "color": { "type": "string", "description": "Stroke/line color (hex/CSS)." },
                "weight": {
                    "type": "number",
                    "minimum": 0,
                    "description": "Stroke width in pixels."
                },
                "opacity": {
                    "type": "number",
                    "minimum": 0,
                    "maximum": 1,
                    "description": "Stroke opacity (0–1)."
                },
                "dashArray": {
                    "type": ["string", "null"],
                    "description": "Dash pattern, e.g. \"5 10\". null = solid line."
                },
                "lineCap": {
                    "type": "string",
                    "enum": ["butt", "round", "square"],
                    "description": "Line cap style."
                },
                "lineJoin": {
                    "type": "string",
                    "enum": ["bevel", "miter", "round"],
                    "description": "Line join style."
                },
                "radius": {
                    "type": "number",
                    "minimum": 0,
                    "description": "Circle radius in pixels. Point layers."
                },
                "shape": {
                    "type": "string",
                    "enum": ["circle"],
                    "description": "Point shape. ONLY \"circle\" is supported. The key is currently inert — nothing reads it — and is kept as a reserved extension point. Previously typed as free-form text advertising \"square\", which the engine never rendered: MapLibre's `circle` layer draws circles only, and a square would require a whole second render path (a `symbol` layer over a generated SDF icon), plus re-implementing taxonomy paint, the pending-sync badge and styleRules on that path. Restricted so the schema stops promising a capability that does not exist."
                },
                "hatch": {
                    "type": "object",
                    "description": "Canvas-based hatch fill pattern.",
                    "additionalProperties": false,
                    "patternProperties": { "^_comment": {} },
                    "properties": {
                        "enabled": { "type": "boolean" },
                        "type": { "type": "string" },
                        "spacingPx": { "type": "number" },
                        "angleDeg": { "type": ["number", "null"] },
                        "renderMode": { "type": "string", "enum": ["overlay", "pattern_only"] },
                        "stroke": {
                            "type": "object",
                            "additionalProperties": false,
                            "patternProperties": { "^_comment": {} },
                            "properties": {
                                "color": { "type": "string" },
                                "opacity": { "type": "number", "minimum": 0, "maximum": 1 },
                                "widthPx": { "type": "number", "minimum": 0 }
                            }
                        }
                    }
                },
                "casing": {
                    "type": "object",
                    "description": "Double-line casing effect (thick outline rendered behind the main stroke).",
                    "additionalProperties": false,
                    "patternProperties": { "^_comment": {} },
                    "properties": {
                        "enabled": { "type": "boolean" },
                        "color": { "type": "string" },
                        "opacity": { "type": "number", "minimum": 0, "maximum": 1 },
                        "widthPx": { "type": "number", "minimum": 0 },
                        "dashArray": {
                            "type": ["string", "null"],
                            "description": "Dash pattern for the casing, e.g. \"2 2\". null = solid."
                        },
                        "lineCap": {
                            "type": "string",
                            "enum": ["butt", "round", "square"],
                            "description": "Casing line cap style."
                        },
                        "lineJoin": {
                            "type": "string",
                            "enum": ["bevel", "miter", "round"],
                            "description": "Casing line join style."
                        }
                    }
                },
                "paint": {
                    "type": "object",
                    "description": "Native MapLibre GL paint properties passed through as-is. Keys are MapLibre property names (e.g. \"fill-color\", \"circle-radius\").",
                    "additionalProperties": true
                },
                "expressionPaint": {
                    "type": "object",
                    "description": "Native MapLibre GL paint properties (expression form) passed through as-is.",
                    "additionalProperties": true
                },
                "fillExtrusionColor": {
                    "type": "string",
                    "description": "Fill-extrusion face color (hex/CSS). Required for fill-extrusion layers."
                },
                "fillExtrusionOpacity": {
                    "type": "number",
                    "minimum": 0,
                    "maximum": 1,
                    "description": "Fill-extrusion global opacity (0–1). Default: 1.0."
                },
                "fillExtrusionHeight": {
                    "oneOf": [{ "type": "number", "minimum": 0 }, { "type": "string" }],
                    "description": "Fill-extrusion height in metres. Number = fixed value, string = feature field name. Required for fill-extrusion layers."
                },
                "fillExtrusionBase": {
                    "oneOf": [{ "type": "number", "minimum": 0 }, { "type": "string" }],
                    "description": "Fill-extrusion base height in metres. Default: 0."
                }
            }
        },
        "styleRule": {
            "type": "object",
            "required": ["style"],
            "additionalProperties": false,
            "patternProperties": { "^_comment": {} },
            "properties": {
                "when": {
                    "$ref": "#/definitions/styleCondition"
                },
                "label": {
                    "type": "string",
                    "description": "Optional human-readable rule label."
                },
                "style": {
                    "$ref": "#/definitions/flatStyle"
                },
                "legend": {
                    "type": "object",
                    "additionalProperties": false,
                    "patternProperties": { "^_comment": {} },
                    "properties": {
                        "label": { "type": "string" },
                        "order": { "type": "number" }
                    }
                }
            }
        },
        "styleCondition": {
            "type": "object",
            "description": "Style rule condition. Either a single field/operator/value check, or an \"all\" compound.",
            "additionalProperties": false,
            "patternProperties": { "^_comment": {} },
            "properties": {
                "field": {
                    "type": "string",
                    "description": "Feature property path, e.g. \"properties.type\"."
                },
                "operator": {
                    "type": "string",
                    "enum": [
                        "==",
                        "===",
                        "eq",
                        "!=",
                        "!==",
                        "neq",
                        ">",
                        ">=",
                        "<",
                        "<=",
                        "contains",
                        "startsWith",
                        "endsWith",
                        "in",
                        "notIn",
                        "between"
                    ],
                    "description": "Comparison operator."
                },
                "value": {
                    "description": "Value to compare against. Can be string, number, boolean, or array (for in/notIn/between)."
                },
                "all": {
                    "type": "array",
                    "description": "Compound AND condition.",
                    "items": { "$ref": "#/definitions/styleCondition" }
                }
            }
        }
    }
}
