{
    "id": "defaut",
    "label": {
        "enabled": true,
        "visibleByDefault": true,
        "field": "ville",
        "font": {
            "sizePt": 7
        },
        "color": "#323232",
        "opacity": 1,
        "buffer": {
            "enabled": true,
            "color": "#fafafa",
            "sizePx": 3.78
        }
    },
    "description": "",
    "scaleConfig": {
        "minScale": 8000000,
        "maxScale": 10000
    },
    "labelScale": {
        "minScale": 3600000,
        "maxScale": 1000
    },
    "style": {
        "shape": "circle",
        "radius": 2.27,
        "fillColor": "#000000",
        "fillOpacity": 1,
        "color": "#000000",
        "opacity": 1,
        "weight": 0.76
    },
    "legend": {
        "label": "Villes principales"
    }
}
