{
    "id": "defaut",
    "label": "Défaut",
    "description": "",
    "labelScale": { "minScale": null, "maxScale": null },
    "style": {
        "shape": "circle",
        "radius": 9,
        "fillColor": "#6366f1",
        "fillOpacity": 1,
        "color": "#ffffff",
        "opacity": 1,
        "weight": 1
    },
    "legend": { "label": "Armoires électriques" }
}
