{
    "id": "defaut",
    "label": {
        "enabled": true,
        "visibleByDefault": false,
        "field": "ref",
        "font": {
            "sizePt": 6
        },
        "color": "#323232",
        "opacity": 1,
        "buffer": {
            "enabled": true,
            "color": "#fafafa",
            "sizePx": 3.78
        }
    },
    "description": "",
    "scaleConfig": {
        "minScale": 7500000,
        "maxScale": 100000
    },
    "labelScale": {
        "minScale": 4500000,
        "maxScale": 0
    },
    "style": {
        "casing": {
            "enabled": true,
            "color": "#000000",
            "opacity": 1,
            "widthPx": 1
        },
        "color": "#ffffff",
        "opacity": 1,
        "weight": 1.5
    },
    "legend": {
        "label": "routes principales"
    }
}
