{
    "id": "defaut",
    "label": "défaut",
    "description": "",
    "labelScale": {
        "minScale": null,
        "maxScale": null
    },
    "style": {
        "shape": "circle",
        "radius": 9,
        "fillColor": "#e74c3c",
        "fillOpacity": 1,
        "color": "#ffffff",
        "opacity": 1,
        "weight": 2
    }
}
